Cluster ID,Número de Abstracts,Ejemplo de Abstract
270,2,"A significant fraction of computational software for scientific research grows through accretion. In a common scenario, a small group develops a code for a specific purpose. Others find the software useful, so they add to it for their own use. The ..."
747,1,"Idea generation in the design production process often occurs within brainstorming sessions. Linking ideas is the key mechanism in the process of producing design. Through linking ideas, a graph-like knowledge is achieved in representing the individual ..."
29,3,"The capability for solving compressible fluid flows in the rotating frame of reference is added to an existed open-source CFD solver, namely, HiSA solver. The new implementation is explained and validated using the experimental data of the Sikorsky S-76 ..."
1273,1,"Mapping a public discourse with the tools of computational text analysis comes with many contingencies in the areas of corpus curation, data processing and analysis, and visualisation. However, the complexity of algorithmic assemblies and the beauty of ..."
1265,1,"In this dialogue, Phillip Howard introduces computational propaganda as an emerging communication tool in political communication and a perspective for investigating misinformation and disinformation. By articulating the concepts, patterns, and ..."
2018,1,"Since the publication in 1948 of Norbert Wieners Cybernetics, this thought model has exerted a profound influence in contemporary knowledge. Such influence has been decisive for a paradigm shift in the profession of architecture and particularly for the ..."
1043,2,"Psychiatric research is in crisis. We highlight efforts to overcome current challenges by focusing on the emerging field of computational psychiatry, which might enable the field to move from a symptom-based description of mental illness to descriptors ..."
2270,1,The prevalent availability of high-performance computing coupled with validated computerized simulation platforms as open-source packages have motivated progress in the development of realistic anthropomorphic computational models of the human anatomy. ...
577,1,Much debate has taken place on Joseph Needham's question regarding the failure of China and India to give rise to distinctively modern science while being ahead of Europe for fourteen previous centuries. It is argued in this paper that while there is ...
168,1,"This paper documents a computational approach to the design, fabrication, and assembly of customizable space structures built entirely out of flat-cut interlocking elements without the need of nodes, fasteners, cement, or glue. Following a Research by ..."
1260,1,"Reproducibility is fundamental to science, and an important component of reproducibility is computational reproducibility: the ability of a researcher to recreate the results of a published study using the original authors raw data and code. Although ..."
404,1,"Computational Intelligence (CI) models comprise robust computing methodologies with a high level of machine learning quotient. CI models, in general, are useful for designing computerized intelligent systems/machines that possess useful characteristics ..."
2309,1,"Artificial intelligence (AI) has emerged as a prominent topic in K-12 education recently. However, pedagogical design has remained a major challenge, especially among young learners. Guided by the Zone of Proximal Development theory and AI education ..."
28,2,A fluidstructure interaction numerical simulation was performed to investigate the flow field around a flexible flapping wing using an in-house developed computational fluid dynamics/computational structural dynamics solver. The three-dimensional (3D) ...
2098,1,"Predictive toxicology plays a critical role in reducing the failure rate of new drugs in pharmaceutical research and development. Despite recent gains in our understanding of drug-induced toxicity, however, it is urgent that the utility and limitations of ..."
206,2,"Computational biology allows and encourages the application of many different parallelism-based technologies. This special issue brings together high-quality state-of-the-art contributions about parallelism-based technologies in computational biology, ..."
2749,1,"This article describes PSI theory, which is a formalized computational architecture of human psychological processes. In contrast to other existing theories, PSI theory not only models cognitive, but also motivational and emotional processes and their ..."
43,2,The University of Florida Department of Mechanical and Aerospace Engineering recently created a new senior technical elective in the field of computational fluid dynamics. The main objectives of the class are learning the process of computational fluid ...
2741,1,"There has been significant recent interest in Agent Based Modeling in many social sciences including economics, sociology, anthropology, political science, and game theory. This article describes three problems that need to be addressed in order for such ..."
1047,1,A survey of the main challenges in computational aeroelasticity is presented and recent ideas and developments are discussed. Advances over the past 25 years have to a large extent been paced by the required developments in computational fluid ...
2927,1,"In this paper, we propose to use a computational method of chaos control to simulate complex experimental spectra. This computational chaos control technique is based on the OttGrebogiYork (OGY) method. We chose the logistic map as the base mathematical ..."
1570,1,"Today, there is an ever-increasing amount of biological and clinical data available that could be used to enhance a systems-based understanding of disease progression through innovative computational analysis. In this article, we review a selection of ..."
978,2,"Scientists can reason about natural systems, including the mind and brain, in many ways, with each form of reasoning being associated with its own set of limitations. The limitations on human reasoning imply that the process of reasoning about theories ..."
552,1,"Purpose: This article aims to shed light on a latest education informatization policy blueprint in China, titled Education Informatization 2.0 Action Plan, which was promulgated by the Ministry of Education in China on April 18, 2018. Design/Approach/..."
1538,1,"The substantial volume, continued growth, and resulting complexity of the scientific literature not only increases the need for systematic, replicable, and rigorous literature reviews, but also highlights the natural limits of human researchers ..."
1613,2,"This commentary advances the hack as an urban concept. While the hack transcends existing literatures on the digital and informality, it is a distinctive concept and is being used systematically in new domains. I situate the hack conceptually, outline ..."
2852,1,"This study examines the effectiveness of a collaborative support method in enhancing programming learning outcomes in a serious game. The game Code Hasp was developed to facilitate the comparison between two support methods, worked examples and a ..."
982,1,"The emergence of text-to-image generative AI tools has garnered significant attention, particularly in creative design applications. This review article explores the field of AI-driven computational creativity, which has witnessed advancements in ..."
1655,1,The proliferation of digital data has been the impetus for the emergence of a new discipline for the study of social life: computational social science. Much research in this field is founded on the premise that society is a complex system with emergent ...
1630,1,"Neural-Symbolic Integration (NSI) aims to marry the principles of symbolic AI techniques, such as logical reasoning, with the learning capabilities of neural networks. In recent years, many systems have been proposed to address this integration in a ..."
1312,1,Brain atlases have a wide range of use from education to research to clinical applications. Mathematical methods as well as computational methods and tools play a major role in the process of brain atlas building and developing atlas-based applications....
2999,1,"Computational Logic plays a very relevant role in engineering complex systems. It can be used to specify systems at different levels of abstraction. The specifications are executable, thus providing a working prototype for free. Thanks to its well-founded ..."
1523,1,"Computational Intelligence (CI) is a computer science discipline encompassing the theory, design, development and application of biologically and linguistically derived computational paradigms. Traditionally, the main elements of CI are Evolutionary ..."
2809,1,"Scientific discovery is a driving force for progress involving creative problem-solving processes to further our understanding of the world. The process of scientific discovery has historically been intensive and time-consuming; however, advances in ..."
1163,2,"The rise of decision processes in various sectors has led to the adoption of decision support systems (DSSs) to support human decision-makers but the lack of transparency and interpretability of these systems has led to concerns about their reliability, ..."
153,1,"This article outlines a general epistemological framework of data journalism in the devolved nations of the United Kingdom. By using an original model based on three conceptual lenses  materiality, performativity and reflexivity  this study examines the ..."
443,1,Promoting the education of talented and gifted students is a crucial aspect of establishing a strong society focused on scientific knowledge. This praxis article delves into the implementation of strategies in the Syrian Arab Republic to support and ...
2619,1,"Pregnancy can be accompanied by serious health risks to mother and child, such as pre-eclampsia, premature birth and postpartum haemorrhage. Understanding of the normal physiology of uterine function is essential to an improved management of such risks. ..."
1147,1,"The Computer Science (CS) for All national movement is increasingly relying on state-level change to broaden participation in computing. To foster an environment in which all students have opportunities to thrive in CS education, policy action is ..."
807,1,"Detailed experimental measurements of a compressor (pressure, temperature, speed) are not easily available because of size, cost, and access difficulties. A comprehensive computer model is necessary to obtain pressure-volume diagrams for the compressor. ..."
2371,1,"Background: Multiple sclerosis (MS) is commonly associated with decision-making, neurocognitive impairments, and mood and motivational symptoms. However, their relationship may be obscured by traditional scoring methods. Objectives: To study the ..."
2692,2,"This article presents steps that can be used to expose children to concrete experiences of practicing coding using unplugged activities, including using directional words or directional arrows, using sequential words, combining both directional and ..."
1781,1,"Multiphysics modeling, code development, and validation by full-scale experiments is presented for hydrodynamic/suspension-dynamic interactions of a novel ocean vehicle, the Wave Adaptive Modular Vessel (WAM-V). The boat is a pontoon catamaran with hinged ..."
1744,1,"We review recent evidence revealing that the mere willingness to engage analytic reasoning as a means to override intuitive gut feelings is a meaningful predictor of key psychological outcomes in diverse areas of everyday life. For example, those with a ..."
42,1,"The teaching of computational fluid dynamics at the undergraduate level usually focuses on giving students an understanding of the numerical methods and details involved, supported by what are little more than code fragments, followed by learning an ..."
877,2,"This article considers the issue of opacity as a problem for socially consequential mechanisms of classification and ranking, such as spam filters, credit card fraud detection, search engines, news trends, market segmentation and advertising, insurance or ..."
2547,1,"It is often claimed that computational methods for examining textual data give good enough party position estimates at a fraction of the costs of many non-computational methods. However, the conclusive testing of these claims is still far from fully ..."
2352,1,"Computational design affords agency: the ability to orchestrate the material, spatial, and technical architectural system. In this specific case, it occurs through enhanced, authored means to facilitate making and performancetypically driven by concerns ..."
1952,2,"Representative democracy translates the preferences of the electorate into policy outcomes. Individual voters do not directly vote on policy; rather, their elected representatives create and establish policy. How well do the institutions of representative ..."
1870,1,"Objectives: Competent velopharyngeal (VP) function is the basis for normal speech. Understanding how VP structure influences the airflow during speech details is essential to the surgical improvement of pharyngoplasty. In this study, we aimed to illuminate ..."
2752,1,Psychology endeavors to develop theories of human capacities and behaviors on the basis of a variety of methodologies and dependent measures. We argue that one of the most divisive factors in psychological science is whether researchers choose to use ...
2755,1,"Computational modeling has long been advocated as an important tool in the scientists tool shed. They are common in physical and biological sciences, but are very rare in organizational psychology. This paper describes the role computational models might ..."
1185,1,Background The creation and management of an autologous arteriovenous fistula (AVF) as vascular access (VA) for hemodialysis patients is still a critical procedure. The placement of a functional and long-lasting VA derives from adequate planning of the ...
2628,1,"With the development of the 4th Industrial Revolution (4th IR), its emerging technologies and skills; there is a mismatch between 4th IR, and the skills needed by information professionals to survive. This paper bridges the gap based on the skills needed ..."
30,2,"This paper describes a study of the use of computational fluid dynamics (CFD) to investigate the performance of a precalciner vessel at a cement works, In this vessel, limestone, held in suspension, is calcined to calcium oxide and the endothermic ..."
2635,1,"Advanced non-linear dynamics, finite element computational methods and tools are utilized in order to assess the blast wave mitigation potential of the fluidstructure interaction phenomena involving rigid and deformable structures. The employed ..."
398,1,Schizophrenia is an illness with a remarkably complex symptom presentation that has thus far been out of reach of neuroscientific explanation. This presents a fundamental problem for developing better treatments that target specific symptoms or root ...
1900,1,"In this article, the implementation of the pitch-control option is described within the OpenFOAM computational fluid dynamics library supported by the preliminary results for a few representative test cases. The proposed pitch-control logic represents a ..."
2514,1,"This commentary elaborates on the ideas and projects outlined in this special issue, from a specifically sociological perspective. Much recent work in sociology proposes methods mashups of ethnography and digital data/computational tools in different ..."
33,1,Computational fluid dynamics (CFD) probably plays a greater part in the aerodynamic design of turbomachinery than it does in any other engineering application. For many years the design of a modern turbine or compressor has been unthinkable ...
2423,1,"In the last 20 years, a new approach has emerged to investigate the physiopathology of circulation. By merging medical images with validated numerical models, it is possible to support doctors decision-making process. The iCardioCloud project aims at ..."
2116,1,"During the last few years a growing amount of content produced by Internet users has become publicly available online. These data come from a variety of places, including popular social web services like Facebook and Twitter, consumer services like Amazon ..."
2682,1,Objective: We developed a computational model of the effects of sleep deprivation on the vigilance decrement by employing the methods of system dynamics modeling. Background: Situations that require sustained attention for a prolonged duration can cause a ...
3084,1,"In this article we propose a computational model that describes how observed behavior can influence an observers own behavior, including the acquisition of new task descriptions. The sources of influence on our models behavior are: beliefs about the ..."
2163,1,"We compare three theoretical frameworks for pursuing explanatory integration in psychiatry: a new dimensional framework grounded in the notion of computational phenotype, a mechanistic framework, and a network of symptoms framework. Considering the ..."
1778,1,What is algorithmic thought? It is not possible to address this question without first reflecting on how the Universal Turing Machine transformed symbolic logic and brought to a halt the universality of mathematical formalism and the biocentric speciation ...
1198,1,"Corrosion greatly affects the integrity of many engineering structures, such as bridges, pipelines, nuclear reactors, and aircraft. This study provides an overview of the computational intelligence methods developed for the corrosion damage assessment of ..."
2756,1,This paper describes a computational model of optical flow and demonstrates how it can be used to estimate the navigation velocity of the user's viewpoint during a virtual reality (VR) simulation. The model takes as input a VR simulation video sequence ...
1267,1,"The size and variation in both meaning-making and populations that characterize much contemporary text data demand research processes that support both discovery, interpretation and measurement. We assess one dominant strategy within the social sciences ..."
35,2,The great demands for computational fluid dynamics (CFD) practitioners in industry have motivated universities to integrate CFD courses into undergraduate curricula. This article introduces a learning-centred CFD course that aims to train critical users ...
44,2,"In recent years, the computational fluid dynamics method has developed into very useful tools for investigating the oil flow and the no-load losses in geared transmissions. It has neither restriction on the housing shape nor limitations on the lubrication ..."
3115,1,The contemporary prevalence of artificial intelligence and machine learning methods has resulted in a rich literature on the factors that shape computational research. This article draws on the laboratory studies literature to examine how platforms socio-...
2069,1,"The purpose of the study was to compare the deficit profiles of two important types of mathematics difficulties. Three cognitive measures (working memory, processing speed, and reasoning), two mathematics measures (numerical facts retrieval and ..."
1520,1,"The abstraction of cryptographic operations by term algebras, called DolevYao models, is essential in almost all tool-supported methods for proving security protocols. Recently significant progress was made in proving that DolevYao models offering the ..."
2154,1,"Mel Ember was co-Principal Investigator in the Mason-HRAF Joint Project on Eastern Africa, a multiyear project aimed at developing and analyzing advanced computational agent-based models of human societies across 10 countries and 12 ecosystems. A major ..."
3166,1,Background. Educational games are nowadays used for facilitating the teaching and learning process of various subjects. History is one of the subjects that simulations and games are used for promoting active learning and supporting students in ...
3089,1,The pervasive role of computers in finance is strongly affecting the way investors operate on the stock market. In the last few years there has been a strong focus on short-time transactions that is the subject of many studies in the emerging field of ...
2944,2,"A three-dimensional computational model is established to simulate the air flow patterns in the rotor spinning unit of a rotor spinning machine. The effects of rotor speed, rotor diameter and rotor slide wall angle on air flow characteristics and hence ..."
2120,1,"Querying its own history is an important mechanism in the computations, especially those interacting with people or other computations such as transaction processing, electronic data interchange. John McCarthy in his Elephant programming language proposal ..."
2180,1,"Metacognition supports reflection upon and control of other cognitive processes. Despite metacognition occupying a central role in human psychology, its neural substrates remain underdetermined, partly due to study-specific differences in task domain and ..."
589,1,"The British government is claiming digital skills will deliver economic growth to the country and social mobility to young people: its ministers call it a pipeline to prosperity. While declaring this pipeline, the government assumes the needs of the ..."
2210,1,This article proposes and tests a reproducible framework for a computational method to measure social media-based deliberative discourse by analyzing commentary surrounding the Canadian convoy protests of COVID-19 vaccine mandates and restrictions. ...
618,1,Purpose This article takes a postfoundational lens to reflect upon my ethnographic (re)searching experience in a Hong Kong high school biology classroom to expose ignorant theoreticalmethodological assumptions of researchers and teachers on critical ...
2742,1,"This article synthesizes a large body of research in the social and cognitive sciences to develop a distinctly cognitive understanding of political identity. Building on dual-process and computational theories of mind, the article defends three claims ..."
1095,1,"In recent years, the integration of modern technologies such as virtual reality (VR) and augmented reality (AR) has transformed teaching techniques, providing new approaches to engage students and improve learning outcomes. The study aims to analyze the ..."
2703,1,"The subject of nanofriction having its origins in the late 19th century has slowly but surely started picking up lately. With rapid advancements in science and technology throughout the last century, understanding nanofriction has been gaining prominence. ..."
790,2,"This article argues the advance of computational methods for analyzing, visualizing and disseminating social scientific data can provide substantial tools for ethnographers operating within the broadly realist normal-scientific tradition (NST). While ..."
2380,1,"Computational Intelligence (CI) paradigms reveal to be potential tools to face under the Web uncertainty. In particular, CI techniques may be properly exploited to handle Web usage data and develop Web-based applications tailored on users preferences. The ..."
932,2,"Aerodynamics research in cycling has underpinned innovative bicycle design, new refined riding positions and optimised rider apparel. There has been a rise in the level of aerodynamics research focused on cycling since the turn of the millennium, enabled ..."
1063,1,"Two options fuel the debate on the cognitive processes underlying the perception of affordances. On the one hand, the ecological theory of affordance fits with the methodological assumptions of the dynamical systems theory of cognition. On the other hand, ..."
313,2,"Social media, in general, and Facebook in particular, have been clearly identified as important platforms for the dissemination of mis- and disinformation and related problematic content. However, the patterns and processes of such dissemination are still ..."
558,1,"How do children learn to read? How do deficits in various components of the reading network affect learning outcomes? How does remediating one or several components change reading performance? In this article, we summarize what is known about learning to ..."
2260,1,"Anxiety is a pervasive emotional state that tends to arise in situations involving uncertainty due partly to social and contextual issues including competition, economic disparity, and social insecurity. Thus, distribution of aggregate emotions, such as ..."
3047,1,This study implemented and evaluated the innovative use of a performance-based assessment platform to support the development of self-regulated learning (SRL) in senior primary students as they completed programming tasks. We embedded SRL support features ...
1827,1,"FEATURE AT A GLANCE: The earliest stage of the design process, known as conceptual design, is crucial to the overall effectiveness of the end product. Of particular importance is the search of the design space for ideas and concepts, which is restricted ..."
2770,2,"This paper demonstrates the suitability of using computational fluid dynamics software for solving steady state hydrodynamic lubrication problems pertaining to slider bearings, step bearings, journal bearings and squeeze-film dampers under ..."
2137,1,"Natural monotonic linguistic language is widely used to express experts uncertain subjective appraisal opinion, such as More than, At least, Less than and At most, which reveals explicit information about performance range and implicit ..."
504,1,"This review article provides a critical assessment of the progress made in computational modelling of metal-based additive manufacturing (AM) with emphasis on its ability to predict physical phenomena, concepts of microstructural evolution, residual ..."
