Cluster ID,Número de Abstracts,Ejemplo de Abstract
377,2,"Although computational thinking (CT) is becoming increasingly prevalent in K-12 education, many teachers find it challenging to integrate it with their classroom learning. In this systematic review, we have re..."
171,1,"Contemporary science is a field that is becoming increasingly computational. Todays scientists not only leverage computational tools to conduct their investigations, they often must contribute to the design o..."
2172,1,"This research explored the creative thinking, learning achievement, and engagement of students when they integrated the application of the personal audio classifier (PAC) into the competition of a computationa..."
180,6,"While various studies have focused on the significance of computational thinking (CT) for the future career paths of individuals in science, technology, engineering, and mathematics (STEM), few studies have fo..."
2546,1,"This paper introduces project-based learning (PBL) features for developing technological, curricular, and pedagogical supports to engage students in computational thinking (CT) through modeling. CT is recogniz..."
1131,1,"Researchers are increasingly exploring educational games in immersive virtual reality (IVR) environments to facilitate students learning experiences. Mainly, the effect of IVR on learning outcomes has been th..."
729,2,"In our interconnected world, Systems Thinking (ST) is increasingly being recognized as a key learning goal for science education to help students make sense of complex phenomena. To support students in masteri..."
424,1,Educational robotics (ER) is increasingly used in classrooms to implement activities aimed at fostering the development of students computational thinking (CT) skills. Though previous works have proposed diff...
2292,2,"Interests towards teaching programming skills have risen recently in the realm of computing education. Learning how to program not only enables learners to develop computing applications, but it can also enhan..."
391,2,"There exist shared competencies between computational thinking (CT) and mathematics, and these two domains also mutually benefit from various teaching approaches. However, the linkages between mathematics and ..."
378,2,"Integrating computational thinking (CT) into STEM education has recently drawn significant attention, strengthened by the premise that CT and STEM are mutually reinforcing. Previous CT-STEM studies have examin..."
2410,2,"Unplugged activities as a low-cost solution to foster computational thinking (CT) skills seem to be a trend in recent years. However, current evidence of the effectiveness of unplugged activities in promoting ..."
970,1,"Deductive and theory-driven research starts by asking questions. Finding tentative answers to these questions in the literature is next. It is followed by gathering, preparing and modelling relevant data to em..."
423,2,"To better understand students computational thinking skills (CTS) within the context of flipped-classroom instruction, a structural equation modeling analysis is employed to examine the key factors that influ..."
2589,2,"This article investigates the role of problem representation in complex problem-solving based on quasi-experimental data analysis, specifically within the context of computational thinking. Using the Tower of ..."
282,2,"In the digital age, fostering young childrens computational thinking (CT) and executive functions (EFs) through programming has emerged as a significant research issue. While unplugged programming activities ..."
399,2,Creative and problem-solving competencies are part of the so-called twenty-first century skills. The creative use of digital technologies to solve problems is also related to computational thinking as a set of...
2638,1,"In recent years, programming education has gained recognition at various educational levels due to its increasing importance. As the need for problem-solving skills becomes more vital, researchers have emphasi..."
864,1,"This paper proposes an Internet of Things device (IoT)-based ecosystem that can be leveraged to provide children and adolescent students with STEM educational activities. Our framework is general and scalable,..."
2487,1,This article focuses on empirically analyzing the final products designed by 147 academics from 11 countries who participated in an international open education movement workshop by answering the research ques...
2056,1,"This work addresses from the perspective of evolutionary pressure, the delicate issue of the mechanisms and causes that are behind the emergence of the faculty of language among early Homo sapiens ancestors. I..."
651,2,Relational thinking involves understanding equivalence and numerical relationships. The present study examined the relational thinking of seventh graders before and after a 15-day mental mathematics interventi...
2071,1,"The objective is to present a proposal for a gender-sensitive risk analysis model using artificial intelligence (AI) within the framework of complex thinking that provides access to opportunities, specifically..."
3071,1,"The present discussion examines the transformative impact of Artificial Intelligence (AI) in educational settings, focusing on the necessity for AI literacy, prompt engineering proficiency, and enhanced critic..."
2924,2,"Computational approaches in STEM foster creative extrapolations of ideas that extend the bounds of human perception, processing, and sense-making. Inviting teachers to explore computational approaches in STEM ..."
2787,2,This study posits that scaffolded team-based computational modeling and simulation projects can support model-based learning that can result in evidence of representational competence and regulatory skills. Th...
2832,2,"Using games in education has the potential to increase students motivation and engagement in the learning process, gathering long-lasting practical knowledge. Expanding interest in implementing a game-based a..."
1639,1,"Internationally, coding is increasingly introduced into primary and junior high schools (children generally aged between 5 and 15) on a compulsory basis, though not all stakeholders support this initiative. ..."
699,2,The rapid advancement of digital technology has not only affected the world of work but also students' learning. Digital learning competence (DLC) is one of the essential skills students need for effective lea...
1168,3,"Along with the increasing attention to artificial intelligence (AI), renewed emphasis or reflection on human intelligence (HI) is appearing in many places and at multiple levels. One of the foci is critical th..."
2267,1,"In this work, BEAM robotics is proposed to enhance the STEM knowledge and skills of engineering students in the electrical, electronic, and mechanical domains. To evaluate the proposal, a course is designed an..."
148,2,Computer-based virtual learning environments (CBVLEs) are potentially useful teaching tools for training nursing students in professional duties such as the mathematical tasks associated with medication proces...
3139,4,"In her 2021 IC2S2 keynote talk, Critical Data Theory, Margaret Hu builds off Critical Race Theory, privacy law, and big data surveillance to grapple with questions at the intersection of big data and legal j..."
654,2,Computational thinking (CT) is crucial to fostering critical thinking and problem-solving skills. Many elementary schools have been cultivating students CT through block-based programming languages such as Sc...
387,1,"The purpose of this study is to discover the main themes and categories of the research studies regarding digital literacy. To serve this purpose, the databases of WoS/Clarivate Analytics, Proquest Central, Em..."
1837,1,"This paper explores the evolving landscape of informatics education in European primary and secondary schools, analysing academic and grey literature to define the state of play and open questions related to ..."
627,3,"Educational designers are working to embed computation in required classes outside of computer science (CS) courses, to promote equitable access for all students. While many studies embed computation in one di..."
1191,1,"Architectural education has been transformed by digital tools, yet significant gaps remain in their application, particularly in supporting the iterative and creative aspects of design thinking. This study aim..."
1463,1,This study presents the development of three research tools of scientific creativity. Our aim is to evaluate the development of student creativity while students write digital stories. Three models are linked ...
2026,2,"Much has been written about Adaptive Learning, but does its implementation alone guarantee success? We have found that integrating an Adaptive Learning Strategy with diverse didactic techniques gives better re..."
740,2,"This concept paper discussed the development of science teacher education programs in Malaysia. The discussion encompassed the existing policies, practices and issues, arising from the science teacher educatio..."
935,2,This paper presents a perspective on AI that starts with going back to early work on this topic originating in theoretical work of Alan Turing. The argument is made that the core idea - that leads to the title...
895,2,"Educational robotics, as emerging technologies, have been widely applied in the field of STEM education to enhance the instructional and learning quality. Although previous research has highlighted potentials ..."
1251,1,Computational modeling is an increasingly common practice for disciplinary experts and therefore necessitates integration into science curricula. Computational models afford an opportunity for students to inve...
1132,1,Learning interaction patterns is key to the explanation of learning outcomes. Different studies have reported the relationship between classroom process variables and learning outcomes in a traditional classro...
3104,1,Curriculum standards are a critical component of a nations educational system and directly impact talent development and overall national development. Most studies on curriculum standards focus on a single co...
1053,1,"Learning assistants (LAs) increase accessibility to instructorstudent interactions in large STEM lecture classes. In this research, we used the Formative Assessment Enactment Model developed for K-12 science ..."
233,3,"In this editorial, we review 400 articles and reviews published in the International Journal of STEM Education during its first decade (20142023). Using bibliometric analysis, we examine these publications to as..."
1746,2,This paper introduces the fundamental concepts of computational surgery by Garbey et al. and proposes a road map for progress in this new multidisciplinary field of applied investigation. Recognizing this intr...
1420,3,The interest-driven creator (IDC) theory is being developed as a group endeavor by Asian researchers to articulate a holistic learning design theory for future education in Asia. The theory hypothesizes that s...
1625,1,"Emerging methodologies that apply and integrate science, technology, engineering, art, and math (STEAM) in education have appeared in recent years as a pedagogical alternative providing more holistic and attra..."
1776,2,"Understanding how people tick is an endeavour that has challenged us for millennia, both in informal settings and in increasingly formalized and scientific disciplines. Some are interested in the biology and o..."
1403,1,"Evidence from the research literature indicates that both audience response systems (ARS) and guided inquiry worksheets (GIW) can lead to greater student engagement, learning, and equity in the STEM classroom...."
1963,1,"With increasing engineering demands, there need high order accurate schemes embedded with precise physical information in order to capture delicate small scale structures and strong waves with correct physics..."
1351,1,"Puberty is a phase in which individuals often test the boundaries of themselves and surrounding others and further define their identity  and thus their uniqueness compared to other individuals. Similarly, as..."
1342,2,"Despite the recent emphasis on technology and engineering in early childhood education, the importance of teaching relevant concepts in early education has been underappreciated in South Korea. This study exam..."
992,2,The development of students' core competencies for the future society has become a shared goal in curriculum reform worldwide. Efforts are being made to investigate which core competencies should be cultivated...
2394,2,"Solanum lycopersicum Linn. (Tomato, Family Solanaceae) is one of the fruits that are most consumed worldwide. The current research intends to emphasise the possibility of positive and therapeutic effects of S. ly..."
2503,1,"Popularly used in marketing and business, gamification has been gaining interest in educational contexts for its potential to invigorate otherwise mundane or difficult processes. A gamified environment transfe..."
1365,1,"Computational intelligence is one of the most powerful data processing tools to solve complex nonlinear problems, and thus plays a significant role in intelligent fault diagnosis and prediction. However, only ..."
41,1,The drift diffusion model (DDM) is a widely applied computational model of decision making that allows differentiation between latent cognitive and residual processes. One main assumption of the DDM that has u...
2915,2,"Computational microscopy, as a subfield of computational imaging, combines optical manipulation and image algorithmic reconstruction to recover multi-dimensional microscopic images or information of micro-obje..."
1355,2,"Human behaviour reflects cognitive abilities. Human cognition is fundamentally linked to the different experiences or characteristics of consciousness/emotions, such as joy, grief, anger, etc., which assists i..."
1336,2,"Computational criminology seeks to address criminological and criminal justice problems through the use of applied mathematics, computer science, and criminology. The development of mathematical and computatio..."
18,2,"Given the large variation in conceptualizations and enactment of K 12 integrated STEM, this paper puts forth a detailed conceptual framework for K 12 integrated STEM education that can be used by researchers, e..."
727,2,The role of engineering education has gained prominence within the context of STEM education. New educational perspectives such as the National Research Councils Framework for K-12 Science Education consider ...
3069,2,"As the demand for higher-order thinking skills continues to rise in the 21st century, the integration of Generative Artificial Intelligence (GAI) into educational practices has emerged as a promising tool. How..."
1638,1,"The coupled influences of scholarship in the fields of Psychology, Philosophy, and Pedagogy beginning in the 1950s, set in motion the emergence of new images, methodological perspectives, theories, and design ..."
1458,1,"This paper describes the design, implementation and research of the Cyber Sleuth Science Lab (CSSL), an innovative educational program and supporting virtual learning environment, that combines pedagogical the..."
1838,1,"This paper presents an empirical analysis of problem-solving digital competence among primary and secondary students. The study explores the relationship between learners personal autonomy, their ability to f..."
1150,2,"The mystery of aesthetics attracts scientists from various research fields. The topic of aesthetics, in combination with other disciplines such as neuroscience and computer science, has brought out the burgeon..."
1,20,This article is part of a Supplement: Volume 8 Supplement 2
409,2,Visual arts refer to art experienced primarily through vision. 3D visual optical art is one of them. Artists use their rich imagination and experience to combine light and objects to give viewers an unforgetta...
1671,1,"The expanding use of IT has brought an increase in productivity to the world of business, industry and commerce. However, this is not mirrored by an equivalent growth in the use of IT by aid agencies in post-d..."
1834,1,This paper explores the epistemologies and discourse of undergraduate students at the transdisciplinary intersection of engineering and the arts. Our research questions focus on the kinds of knowledge that stu...
1689,2,Early exposure to Computer Science (CS) and Computational Thinking (CT) for all is critical to broaden participation and promote equity in the field. But how does the introduction of CS and CT into primary sch...
3077,2,"Despite the increased adoption of Artificial Intelligence in Education (AIED), several concerns are still associated with it. This has motivated researchers to conduct (systematic) reviews aiming at synthesizi..."
1360,2,"Fostering students competence in applying interdisciplinary knowledge to solve problems has been recognized as an important and challenging issue globally. This is why STEM (Science, Technology, Engineering, ..."
904,1,Games are seen as environments that promote the engagement of children to the learning of Computational Thinking (CT) concepts. The new forms of interaction using body movements and gestures have increased in ...
2869,1,The inductive logic of grounded theory and the principle of avoiding theoretical preconceptions are significantly different from the deductive logic and hypothesis testing of traditional quantitative research....
1501,2,"The basal ganglia (BG) is part of a basic feedback circuit regulating cortical function, such as voluntary movements control, via their influence on thalamocortical projections. BG disorders, namely Parkinson..."
243,2,There has recently been a conscious push for cities across the globe to be smart and even smarter and thus more sustainable by developing and implementing big data technologies and their applications across va...
154,2,This article provides a commentary on Thomas Grunds International Conference on Computational Social Science 2021 keynote Dynamics of Denunciation: The Limits of a Scandal. The keynote presents results from...
474,3,"The pervasive digitization of society underscores the crucial role of data and its significant impact on decision-making across various domains. As a result, it is essential for individuals to acquire competen..."
179,2,"Computational thinking is the capacity of undertaking a problem-solving process in various disciplines (including STEM, i.e. science, technology, engineering and mathematics) using distinctive techniques that ..."
400,2,Education goals have evolved to emphasize student acquisition of the knowledge and attributes necessary to successfully contribute to the workforce and global economy of the twenty-first Century. The new educa...
3081,3,"Sociology is a science concerned with both the interpretive understanding of social action and the corresponding causal explanation, process, and result. A causal explanation should be the foundation of predic..."
813,1,"Improving the effectiveness of education requires progress on both sides of the learning equation: students need to enhance their learning capabilities, and teachers need to refine their teaching strategies. T..."
336,1,This article introduces an ontology-based framework for group assessment analytics that investigates the impact of intra-group interactions on group performance within the context of project-based collaborativ...
1780,2,Individualized treatment is crucial for epileptic patients with different types of seizures. The differences among patients impact the drug choice as well as the surgery procedure. With the advance in machine ...
1721,1,"This paper makes a critical review of educational and operational issues related with pandemic and postpandemic lessons in Latin American higher education institutions (LATAM HEI), as background for uncovering..."
1158,1,An important goal in a number of optimization studies is a high-quality weld joint. Thermal analysis of AISI 1020 low carbon steel plate agglutinated by gas tungsten arc welding technique was carried out using...
2019,1,"Memory, the process of encoding, storing, and maintaining information over time to influence future actions, is very important in our lives. Losing it, it comes with a great cost. Deciphering the biophysical m..."
499,1,"LHPP is a tumor suppressor protein associated with various malignancies like liver, oral, pharyngeal, bladder, cervical, and gastric cancers through controlling various pathways. Several single nucleotide vari..."
2994,1,"Strategic organizational decision making in todays complex world is a dynamic process characterized by uncertainty. Therefore, diverse groups of responsible employees deal with the large amount and variety of..."
834,1,"The existing physical layer security schemes, which are based on the key generation model and the wire-tap channel model, achieve security by utilizing channel reciprocity entropy and noise entropy, respective..."
2316,1,Learning technology periodically undergoes changes in response to changes in the prevailing models of human cognition and learning. A major shift throughout the behavioral sciences that began in the 1980s is b...
784,2,"This study aimed to retrospectively evaluate the influence of contralateral anterior circulation on computational fluid dynamics (CFD) of intracranial arteries, by comparing the CFD values of flow velocities i..."
793,2,Microplastic (MPL) abundance in the environment and the biosphere is a grave problem that is confounded by many aspects with one vital aspect being the characterization of their heterogeneous matrix. Currently...
3074,1,This article analyzes some analogies going from Artificial Life questions about the symbolmatter connection to Artificial Intelligence questions about symbol-grounding. It focuses on the notion of the interpr...
265,2,"Multiscale modeling of neuropsychiatric illness bridges scales of clinical importance: from the highest scales (presentation of behavioral signs and symptoms), through intermediate scales (clinical testing and..."
2384,2,This research proposes a new product development (NPD) framework for innovation-driven deep-tech research to commercialization and tested it with three case studies of different exploitation methods. The propo...
1049,1,"Neurons are characterised by a morphological structure unique amongst biological cells, the core of which is the dendritic tree. The vast number of dendritic geometries, combined with heterogeneous properties ..."
715,1,Two critical challenges in science education are how to engage students in the practices of science and how to develop and sustain interest. The goal of this study was to examine the extent to which high schoo...
648,2,"This study explores pre-service preschool teachers acceptance and self-efficacy towards Educational Robotics (ER) during a university course, and also examines their perceptions of the course."
2616,1,"The application of artificial intelligence (AI) in STEM education (AI-STEM), as an emerging field, is confronted with a challenge of integrating diverse AI techniques and complex educational elements to meet i..."
3011,1,The seriousness of the current crisis urgently demands new economic thinking that breaks the austerity vs. deficit spending circle in economic policy. The core tenet of the paper is that the most important proble...
1036,1,"Energy systems, as critical infrastructures (CI), constitute Cyber-Physical-Social Systems (CPSS). Due to their inherent complexity and the importance of service continuity of CIs, digitization in this context..."
2684,1,We present an introduction to the modeling of networks of nodes which parse the information presented to them into an output. One example is the nodes are excitable neurons which are collected into a nervous s...
3159,1,"Teachers are a critical component to standards-based reform systems, which require that reforms conceived at the national level pass through several layers of the educational system before impacting learning i..."
434,1,"We discuss transforming STEM education using three aspects: learning progressions (LPs), constructed response performance assessments, and artificial intelligence (AI). Using LPs to inform instruction, curricu..."
1042,2,"In recent years, workshops involving programming on computers have been held in elementary education to promote creative thinking. In our experience of conducting programming workshops for children for over 10..."
2440,1,"The purpose of this research was to design a course based on the design-based learning (DBL) model to improve undergraduates web design skills, and to explore the differences in learning effectiveness of stud..."
1380,1,"Hepatitis C virus (HCV) is considered a worldwide health problem since it affects over 3% of the population and causes 300,000 fatalities per year. Chronic infection causes high morbidity and mortality in pati..."
2247,1,We present a large-scale computational 3D topographic microscope that enables 6-gigapixel profilometric 3D imaging at micron-scale resolution across >110 cm2 areas over multi-millimeter axial ranges. Our computat...
2523,1,What do we think about when we mind wander and where do these thoughts come from? We tested the idea that semantically rich stimuli yield patterns of mind wandering that are closely coupled with the stimuli co...
83,2,The relationship between cognitive engagement and learning gains in computer programming has not been well-studied. This study examined the relationship between students cognitive engagement and learning gain...
3143,1,"The leading approaches in Machine Learning are notoriously data-hungry. Unfortunately, many application domains do not have access to big data because acquiring data involves a process that is expensive or tim..."
