Cluster ID,Número de Abstracts,Ejemplo de Abstract
279,1,"Prion is a term used to describe a protein infectious particle responsible for several neurodegenerative diseases in mammals, e.g., Creutzfeldt-Jakob disease. The novelty is that it is protein based infectiou..."
2986,2,"Inferring the source of a diffusion in a large network of agents is a difficult but feasible task, if a few agents act as sensors revealing the time at which they got hit by the diffusion. One of the main limi..."
3116,1,"One of the psychological problems that have become very prevalent in the modern world is depression, where mental health disorders have become very common. Depression, as reported by the WHO, is the second-lar..."
2106,1,"Previous studies investigating proximity and collaboration have not clarified personal elements, such as working or communication style. Here, we show that personal proximityclose similarity in terms of perso..."
1091,3,"A three-dimensional hydrostatic numerical simulation on tsunami-induced topography changes near a harbor is carried out, and sediment transport processes on a significant local deposition near the center of th..."
2993,1,"In this paper, we propose a realization method for a rearrangement task involving multiple movable objects and mobile robots. All of the objects are transported from their initial positions to goal positions. ..."
1148,2,The last two decades have witnessed the explosive growth in the development and use of noninvasive neuroimaging technologies that advance the research on human brain under normal and pathological conditions. M...
1116,1,"This paper explores the application of computer vision and mathematical modeling to analyze the intricate movements involved in weaving a traditional farming tool, the winnowing basket. By utilizing OpenPose a..."
2829,1,We provide primitives for uniquely localizing WSN nodes. The goal is to maximize the number of uniquely localized nodes assuming a fully decentralized model of computation. Each node constructs a cluster of it...
1204,2,"Time-encoding circuits operate in an asynchronous mode and thus are very suitable for ultra-wideband applications. However, this asynchronous mode leads to nonuniform sampling that requires computationally com..."
2009,1,"Modern advancements in configurable hardware, most notably Field-Programmable Gate Arrays (FPGAs), have provided an exciting opportunity to discover the parallel nature of modern image processing algorithms. O..."
73,1,"Capacity is one of the most important parameters in image watermarking. Different works have been done on this subject with different assumptions on image and communication channel. However, there is not a glo..."
2871,1,"This paper links the polarization-sensitive-array signal detection problem to the parallel factor (PARAFAC) model, which is an analysis tool rooted in psychometrics and chemometrics. Exploiting this link, it d..."
1005,2,This paper demonstrates the usefulness of spatial/spatial-frequency representations in image quality assessment by introducing a new image dissimilarity measure based on 2D Wigner-Ville distribution (WVD). The...
3181,1,"This article focuses on an imperfect production inventory model considering product reliability and reworking of imperfect items in three-layer supply chain under fuzzy rough environment. In the model, the sup..."
1890,2,Foldcore is an origami-like structural sandwich core which is manufactured by folding a planar base material into a three dimensional structure. The manufacturing technology is open to a variety of base materi...
1246,1,"We present nonlinear photonic circuit models for constructing programmable linear transformations and use these to realize a coherent perceptron, i.e., an all-optical linear classifier capable of learning the ..."
3182,1,"In this paper, an integrated production-inventory model is presented for a supplier, manufacturer, and retailer supply chain under conditionally permissible delay in payments in uncertain environments. The sup..."
2889,1,"In this paper, we introduce a new concept safety factor in a transportation problem. When items are transported from plants to destinations through different conveyances, there are some difficulties/risks to..."
2048,2,"MicroRNA are emerging as powerful regulators of cell differentiation and tissue and organ development. Several microRNA have been described to play a role in branching morphogenesis, a key step in early lung d..."
1378,2,"An investigation into the mechanism of antihyperlipidemic action of 2-chloromethyl-5,6,7,8-tetrahydrobenzo(b)thieno[2,3-d]pyrimidin-4(3H)-one (LM-1554) was carried out through docking experiments with six differe..."
1765,1,"Nowadays, research initiatives to redesign the Internet are popping up around the world. Each of these projects has a particular focus and its own set of design requirements and key technologies. The panorama ..."
1669,2,"Feature selection is to find useful and relevant features from an original feature space to effectively represent and index a given dataset. It is very important for classification and clustering problems, whi..."
2831,2,"The study was conducted to evaluate the analgesic, anti-inflammatory, antipyretic properties of ethanolic extract of Tacca integrifolia rhizome (EETI) in mice and cytotoxic effects in brine shrimp nauplii followe..."
634,1,This paper proposes a learning policy to improve the energy efficiency (EE) of heterogeneous cellular networks. The combination of active and inactive base stations (BS) that allows for maximizing EE is identi...
1321,1,"This paper employs Unfolded Adjacency Spectral Embedding (UASE) to investigate the temporal evolution of economic relationships between locations in Great Britain. We utilise timestamped, geolocated website hy..."
2766,1,Why do some songs and musicians become successful while others do not? We show that one of the reasons may be the first-mover advantage: artists that stand at the foundation of new music genres tend to be mo...
364,1,"Industrial wireless networks (IWNs) have applications in areas such as critical infrastructure sectors and manufacturing industries such as car manufacturing. In car manufacturing, IWNs can facilitate manufact..."
1016,1,Cognitive radio (CR) networks have drawn great attention in wireless communication fields. Efficient and reliable communication is a must to provide good services and assure a high-quality life for human being...
758,2,"An important observation associated with seismic activity on the Nagamachi-Rifu Fault is the existence of tabular, fluid rich zones at mid-crustal levels. These zones resemble the bright spots seen in many s..."
2122,1,The Collaboratory for the Study of Earthquake Predictability (CSEP) is an international partnership to support research on rigorous earthquake prediction in multiple tectonic environments. This paper outlines ...
1608,1,"Computer science and mathematical theories are combined to analyze the complex interactions among genes, which are simplified to a network to establish a theoretical model for the analysis of the structure, mo..."
1573,1,Designing competitive manufacturing systems with high levels of productivity and quality at a reasonable cost is a complex task. Decision makers must face numerous decision variables which involve multiple and...
1318,1,"The paper deals with the application of Volterra bound Interval type 2 fuzzy logic techniques in power quality assessment. This work proposes a new layout for detection, localization and classification of var..."
2731,1,"Natural infection and then recovery are considered to be the most effective means for hosts to build protective immunity. Thus, mimicking natural infection of pathogens, many live attenuated vaccines such as i..."
2434,1,"The representation of information flow through structural networks, as depicted by functional networks, does not coincide exactly with the anatomical configuration of the networks. Model free correlation metho..."
763,3,"In this paper, we propose a convolutional neural network (CNN) and clustering-based codebook design method. Specifically, we train two different CNNs, i.e., CNN1 and CNN2, to compress the channel state informa..."
1187,1,"Hepatic encephalopathy (HE) is one of the serious complications observed post-TIPS operations in patients with different complications of portal hypertension such as refractory ascites, refractory hydrothorax,..."
3091,2,Spinal muscular atrophy (SMA) is an autosomal recessive genetic neuromuscular disorder that is characterized by gradual muscle weakness and atrophy due to the degeneration of alpha motor neurons that are prese...
1774,1,Exercise can promote adult neurogenesis and improve symptoms associated with schizophrenia and other mental disorders via parvalbumin (PV)-positive GABAergic interneurons in the dentate gyrus ErbB4 is the rece...
1434,1,"The tumor resistance of glioblastoma cells in vivo is thought to be enhanced by their heterogeneity and plasticity, which are extremely difficult to curb in vitro. The external microenvironment shapes the mole..."
316,2,"We used a two-dimensional finite element method to analyze the load-slip characteristics of nailed wooden joints sheathed with a panel. We used tests of nail bending, nail shank embedment in a wood or a panel,..."
781,1,"Recommender systems help users to deal with the information overload problem by producing personalized content according to their interests. Beyond the traditional recommender strategies, there is a growing ef..."
295,2,"Universities are increasingly organized and managed through digital data. The collection, processing and dissemination of Higher Education data is enabled by complex new data infrastructures that include both ..."
26,5,This article is part of a Supplement: Volume 6 Supplement 1
1431,2,Mantle control on planetary dynamos is often studied by imposing heterogeneous core-mantle boundary (CMB) heat flux patterns on the outer boundary of numerical dynamo simulations. These patterns typically ente...
2555,1,"In this paper, we present an analysis of the emotion-exchange patterns that arise from Twitter messages sent during emergency events. To this end, we performed a systematic structural analysis of the multiplex..."
2725,1,"The task of map-matching consists of finding a correspondence between a geographical point or sequence of points (e.g. obtained from GPS) and a given map. Due to many reasons, namely the noisy input data and i..."
3012,1,"Occurrence and distribution of microplastics in different ecosystems have recently become subjects of numerous studies. However, to date the research has focused mainly on marine and freshwater ecosystems and ..."
892,1,"This paper presents a review, classification schemes, critique, a simple meta-analysis and future research implication of fuel consumption optimization (FCO) literature in the air transport sector. This review..."
1484,1,"During their lifespan, stem- or progenitor cells have the ability to differentiate into more committed cell lineages. Understanding this process can be key in treating certain diseases. However, up until now o..."
719,1,"Despite recent achievements in predicting personality traits and some other human psychological features with digital traces, prediction of subjective well-being (SWB) appears to be a relatively new task with ..."
733,1,"Visual sensor networks (VSNs) provide surveillance images/video which must be protected from eavesdropping and tampering en route to the base station. In the spirit of sensor networks, we propose a novel parad..."
1339,1,"Modulation type is one of the most important characteristics used in signal waveform identification. In this paper, an algorithm for automatic digital modulation recognition is proposed. The proposed algorithm..."
2650,1,A new class-based histogram equalization method is proposed for robust speech recognition. The proposed method aims at not only compensating for an acoustic mismatch between training and test environments but ...
626,3,"Fast and accurate estimation of sinusoidal signals plays an important role in many fields like communications, radar, sonar, etc. In underwater signal processing applications, sinusoidal signals usually take t..."
2548,1,"Higher-order tensors can represent scores in a rating system, frames in a video, and images of the same subject. In practice, the measurements are often highly quantized due to the sampling strategies or the q..."
1219,1,Vector quantization is a classical method used in mobile communications. Each sequence of  samples of the discretized vocal signal is associated...
2637,1,"Object correlations are common semantic patterns in virtual environments. They can be exploited to improve the effectiveness of storage caching, prefetching, data layout, and disk scheduling. However, we have ..."
1030,1,Vehicle re-identification is a challenging task that matches vehicle images captured by different cameras. Recent vehicle re-identification approaches exploit complex deep networks to learn viewpoint robust fe...
1623,1,A super-resolution method for simultaneously realizing resolution enhancement and motion blur removal based on adaptive prior settings are presented in this article. In order to obtain high-resolution (HR) vid...
1025,2,This article proposes a real-time test and verification system for full-reference automatic image quality assessment and verification of digital TV sets. Digital camera is used for acquisition of the TV screen...
3021,2,"We propose a decentralized method for obtaining the vision graph for a distributed, ad-hoc camera network, in which each edge of the graph represents two cameras that image a sufficiently large part of the sam..."
520,1,This paper presents a novel approach to detecting onsets in music audio files. We use a supervised learning algorithm to classify spectrogram frames extracted from digital audio as being onsets or nononsets. F...
2972,2,We propose a real-time software system for landmine detection using ground-penetrating radar (GPR). The system includes an efficient and adaptive preprocessing component; a hidden Markov model- (HMM-) based de...
2396,1,In the past decade we have witnessed the failure of traditional polls in predicting presidential election outcomes across the world. To understand the reasons behind these failures we analyze the raw data of a...
1586,1,"As the increase of requirements of accessing and sharing information of people, large social networks have appeared. The influence maximization over social network has been a popular research topic, whose goal..."
1695,1,"With the rapid accumulation of biological datasets, machine learning methods designed to automate data analysis are urgently needed. In recent years, so-called topic models that originated from the field of na..."
1979,1,"In its quest for a common European Spatial Data Infrastructure INSPIRE has also addressed the category of spatio-temporally extended coverages, in particular: raster data. The INSPIRE definition of coverages i..."
1088,2,"It is a problem that the poor gait function of many elderly people affects their activities of daily living (ADL), and deteriorates their quality of life (QoL). To enhance rehabilitation of the gait function, ..."
1535,1,"Autonomous robots are expected to replace dangerous, dirty, and demanding (3D) jobs. At a theme park, surveillance, cleaning, and guiding tasks can be regarded as 3D jobs. The present paper attempts to develop..."
3178,2,"Earths internal magnetic field is generated through motion of the electrically conductive iron-alloy fluid comprising its outer core. Temporal variability of this magnetic field, termed secular variation (SV)..."
2966,1,Robustness against background noise is a major research area for speech-related applications such as speech recognition and speaker recognition. One of the many solutions for this problem is to detect speech-d...
1019,2,"Cognitive Radio (CR), a hierarchical Dynamic Spectrum Access (DSA) model, has been considered as a strong candidate for future communication systems improving spectrum efficiency utilizing unused spectrum of o..."
2354,1,This paper proposes a bargaining-based jammer power allocation scheme for multi-source multi-destination wireless network in the presence of a friendly jammer and a malicious node which eavesdrops erratically....
1973,2,"Magnetotelluric (MT) data are often distorted by near-surface small-scale lateral heterogeneities. Inverting distorted MT data may produce artifacts or false anomalies, leading to unreliable interpretation. Th..."
1018,2,"With the dramatic development of the internet of things (IoT), security issues such as identity authentication have received serious attention. The radio frequency (RF) fingerprint of IoT device is an inherent..."
1750,1,"We present the open-source implementation of the first fully automatic and comprehensive DJ system, able to generate seamless music mixes using songs from a given library much like a human DJ does."
275,2,"We present the CHAOS-7 model of the time-dependent near-Earth geomagnetic field between 1999 and 2020 based on magnetic field observations collected by the low-Earth orbit satellites Swarm, CryoSat-2, CHAMP, SAC-..."
527,1,This study deals with the analysis of Swarm vector magnetic data in order to create a circuit model of electric currents flowing in the Earths polar ionosphere and the inner magnetosphere. The model is compos...
762,3,The precise position and geometry of a fault and the recognition of contemporary active strands are pivotal elements for formulating regulations for earthquake fault zones and fault setbacks. The western front...
1425,2,Two-thirds of the 111 active volcanoes in Japan are covered with snow for several months during winter and demonstrate high hazard and risk potentials associated with snow-related lahars during and after erupt...
1010,1,"In this article, a relay on-off threshold (ROT) based on symbol error rate is derived for the cooperative communication networks with multiple antennas, where the non-orthogonal decode-and-forward (NDF) protoc..."
1310,1,"In this article, we propose a closed-loop precoding method for the Generalized Space Shift Keying (GSSK) modulation scheme, suitable for Multiple-Input-Single-Output (MISO) systems and denoted as adaptive GSSK..."
920,2,We have submitted a secular variation (SV) candidate model for the thirteenth generation of International Geomagnetic Reference Field model (IGRF-13) using a data assimilation scheme and a magnetohydrodynamic ...
795,1,"We consider medium access control (MAC) in multihop sensor networks, where only partial information about the shared medium is available to the transmitter. We model our setting as a queuing problem in which t..."
731,2,"There is increasing demand for wireless sensor networks (WSN) to be able to carry real-time information. However, current WSN technologies are not yet capable of offering quality-of-service (QoS) guarantees, w..."
2215,1,"Infrastructure-less wireless multi-hop networks have long been proposed for natural disaster and warfare scenarios. However, the current demand of such networks has been towards social networking, gaming and u..."
483,1,A heuristic algorithm is developed for the prediction of indoor coverage. Measurements on one floor of an office building are performed to investigate propagation characteristics and validations with very limi...
750,2,"An MJMA 6.5 crustal earthquake occurred during earthquake swarm activity around the northeastern tip of the Noto Peninsula, central Japan, on May 5, 2023. To elucidate the position of this earthquake in the conti..."
1583,1,"Contemporary collective action, much of which involves social media and other Internet-based platforms, leaves a digital imprint which may be harvested to better understand the dynamics of mobilization. Petiti..."
2597,1,"Wikipedia is a prime example of todays value production in a collaborative environment. Using this example, we model the emergence, persistence and resolution of severe conflicts during collaboration by coupl..."
2300,1,Rapid maxillary expansion (RME) is an effective orthopedic procedure that can be used to address problems concerned with the growth of the midface. This procedure also may produce positive side effects on the ...
2218,1,An approach of transmission network expansion planning with embedded constraints of short circuit currents and N-1 security is proposed in this paper. The problem brought on by the strong nonlinearity property...
1845,1,"This study conducted a survey to implement educational applications that can share information even in environments where access points cannot be used. In particular, we investigated whether Bluetooth (widely ..."
176,1,"Deep convolutional neural networks have performed remarkably well on many Computer Vision tasks. However, these networks are heavily reliant on big data to avoid overfitting. Overfitting refers to the phenomen..."
286,2,Neuronal calcium signals propagating by simple diffusion and reaction with mobile and stationary buffers are limited to cellular microdomains. The distance intracellular calcium signals can travel may be signi...
853,2,"Online reviews are often the primary factor in a customers decision to purchase a product or service, and are a valuable source of information that can be used to determine public opinion on these products or..."
2884,1,"The novel coronavirus (SARS-CoV-2), or COVID-19, has emerged and spread at fast speed globally; the disease has become an unprecedented threat to public health worldwide. It is one of the greatest public healt..."
2131,1,"In this paper, an implicit compensated Euler method is introduced for stochastic differential equations with Poisson random measure. A convergence theorem is proved to show that the method obtains a strong ord..."
2475,1,The concept of inherited orthogonality is motivated and an optimality statement for it is derived. Basic adaptive discretizations are introduced. Various properties of difference operators which are directly r...
389,2,"In the Nineties of the last century the European Commission decided to open the railway market to competition, allowing different railway companies to operate on the same network. Under this framework Infrastr..."
327,2,"Some fundamental conditions and hypotheses are established to ensure the existence, uniqueness, and stability to a class of implicit boundary value problems (BVPs) with AtanganaBaleanuCaputo type derivative ..."
893,1,"I present a review of the recent advancements in scattering theory, which provides a unified approach to studying dispersive and hyperbolic equations with general interaction terms and data. These equations en..."
3039,1,"Interpretation of volumetric medical images represents a rapidly growing proportion of the workload in radiology. However, relatively little is known about the strategies that best guide search behavior when l..."
365,1,"The manufacturing industry is characterized by large-scale interdependent networks as companies buy goods from one another, but do not control or design the overall flow of materials. The result is a complex ..."
3112,1,"Using the theory of affordance from perceptual psychology and through discussion of literature within visual data mining and immersive analytics, a position for the multi-sensory representation of big data usi..."
1760,1,"This paper presents a framework for discovering similar users on Twitter that can be used in profiling users for social, recruitment and security reasons. The framework contains a novel formula that calculates..."
1960,1,Constraining the effective rheology of major faults contributes to improving our understanding of the physics of plate boundary deformation. Geodetic observations over the earthquake cycle are often used to e...
1964,1,"In many real-world contexts, there is a pressing need to automatically screen for potential perpetrators, such as school shooters, whose prevalence in the population is extremely low. We first explain one poss..."
2497,1,"Good practices in artificial intelligence (AI) model validation are key for achieving trustworthy AI. Within the cancer imaging domain, attracting the attention of clinical and technical AI enthusiasts, this w..."
2976,2,This paper describes a remote control system for a crawler-type mobile robot with passive sub-crawlers. This system has a great advantage because it utilizes an essential compliant mechanism that allows the an...
2357,1,"In this study, a two-way clutch mechanism using planetary gear meshing was proposed. The proposed mechanism allows low torque loss and high-speed rotation instead of a larger backlash compared to a roller type..."
1446,2,This paper presents a novel mobile robot system that uses a uniaxial wave locomotion mechanism. The proposed mechanism can mechanically produce uniaxial surface waves by a single actuator to rotate a helix com...
1551,2,Spatially resolved transcriptomics is an emerging class of high-throughput technologies that enable biologists to systematically investigate the expression of genes along with spatial information. Upon data ac...
2415,1,Statistical process control is an excellent quality assurance tool to improve thequality of manufacture and ultimately scores on end-customer satisfaction. SPCuses process monitoring charts to record the key q...
2965,2,General speech recognition models require large capacity and strong computing power. Based on small capacity and low computing power to realize speech analysis and semantic recognition is a research area with ...
1056,2,"Database queries are one of the most important functions of a relational database. Users are interested in viewing a variety of data representations, and this may vary based on database purpose and the nature ..."
