Cluster ID,Número de Abstracts,Ejemplo de Abstract
958,2,Quantum algorithms for simulating quantum systems provide a clear and provable advantage over classical algorithms in fault-tolerant settings. There is also interest in quantum algorithms and their implementat...
2020,1,"This paper proposes a method to recognize scene categories using bags of visual words obtained by hierarchically partitioning into subregion the input images. Specifically, for each subregion the Textons distr..."
3030,2,"Since the large diffusion of digital camera and mobile devices with embedded camera and flashgun, the redeyes artifacts have de facto become a critical problem. The technique herein described makes use of thre..."
1802,2,"The study of urban form as a central interest of architects, planners, and urban designers has faced various challenges over time, affecting the representation of this topic in the research, educational, and p..."
1331,1,The null space condition for l1 minimization in compressed sensing is a necessary and sufficient condition on the sensing matrices under which a sparse signal can be uniquely recovered from the observation data v...
1057,1,"Designing and developing distributed cyber-physical production systems (CPPS) is a time-consuming, complex, and error-prone process. These systems are typically heterogeneous, i.e., they consist of multiple co..."
1788,2,"Decades went by since Mark Weiser published his influential work on the computer of the 21st century. Over the years, some of the UbiComp features presented in that paper have been gradually adopted by industr..."
1127,1,"We consider broadcasting a block of packets to multiple wireless receivers under random packet erasures using instantly decodable network coding (IDNC). The sender first broadcasts each packet uncoded once, th..."
1479,1,"Regressions created from experimental or simulated data enable the construction of metamodels, widely used in a variety of engineering applications. Many engineering problems involve multi-parametric physics w..."
1553,3,"This study presents a novel wavestructure interaction model, which is a compatible interface wavestructure interaction model that is based on mesh-free particle methods for free-surface flow analysis; the FE..."
328,2,"The box-girder bridge has recently gained a lot of popularity because of its serviceability, stability, and structural efficiency. The box-girder bridge also has a lower structural weight than any other type o..."
1743,1,"We investigate the dynamic mechanisms underlying intermittent state transitions in a recently proposed neural mass model of epilepsy. A low dimensional model is constructed, which preserves two key features of..."
406,1,"Cell fate transition is a fascinating process involving complex dynamics of three-dimensional (3D) chromatin organization and phase separation, which play an essential role in cell fate decision by regulating ..."
874,1,"Considering learning and how to improve students performances, adaptive educational systems must know the way in which an individual student learns best. In this context, this work presents a comparison betwe..."
616,1,"Modern magnetic microscopy (MM) provides high-resolution, ultra-high-sensitivity moment magnetometry, with the ability to measure at spatial resolutions better than  ..."
2699,1,"We analyze the efficiency of quantum simulations of fermionic and bosonic models in trapped ions. In particular, we study the optimal time of entangling gates and the required number of total elementary gates...."
1224,1,"Dyscalculia, a specific learning disorder per the Diagnostic and Statistical Manual Fifth Edition (DSM-5), involves difficulties in math domains. Research on working memorys link to dyscalculia is crucial for ef..."
1745,2,"This paper aims to investigate the effects of the introduction of an active welfare state measure in France, the Revenu de Solidarite Active, which replaced the old system of social minima. By using a microma..."
430,1,"Wood is a highly heterogeneous material characterized by a number of properties that vary significantly among samples. Even in woods of the same density, substantial differences in properties show up depending..."
2449,1,The goal of this thematic series is to provide a discussion venue about recent advances in the study of networks and their applications to the study of collective behavior in socio-technical systems. The serie...
1038,1,"Recent research shows an increasing interest in the interplay of social networks and infectious diseases. Many studies either neglect explicit changes in health behavior or consider networks to be static, desp..."
1039,1,"Strategic network formation is a branch of network science that takes an economic perspective to the creation of social networks, considering that actors in a network form links in order to maximise some utili..."
2708,1,"We investigate the functioning of a classifying biological neural network from the perspective of statistical learning theory, modelled, in a simplified setting, as a continuous-time stochastic recurrent neura..."
2460,1,"This paper describes the vision behind and the mission of the Maxeler Application Gallery (AppGallery.Maxeler.com) project. First, it concentrates on the essence and performance advantages of the Maxeler dataf..."
690,1,"Contemporary data sets are frequently relational in nature. In retail, for example, data sets are more granular than traditional data, often indexing individual products, outlets, or even users, rather than ag..."
1090,1,"Negative screening is one method to avoid interactions with inappropriate entities. For example, financial institutions keep investment exclusion lists of inappropriate firms that have environmental, social, a..."
205,1,"Precision agriculture in the realm of the Internet of Things is characterized by the collection of data from multiple sensors deployed on the farm. These data present a spatial, temporal, and semantic characte..."
294,2,"Robust vision-based hand pose estimation is highly sought but still remains a challenging task, due to its inherent difficulty partially caused by self-occlusion among hand fingers. In this paper, an innovativ..."
551,1,"Distributed firewall systems emerged with the proposal of protecting individual hosts against attacks originating from inside the network. In these systems, firewall rules are centrally created, then distribut..."
955,2,"Quantum entanglement is a challenging concept within the field of physics education, often eluding a full grasp by both educators and learners alike. In this paper, we report findings from a two-phase empirica..."
1697,1,"Social media are an important source of information about the political issues, reflecting, as well as influencing, public mood. We present an analysis of Twitter data, collected over 6 weeks before the Brexit..."
3099,1,"Convenient access to vast and untapped collections of documents generated by organizations is a highly valuable resource for research. These documents (e.g., press releases) are a window into organizational st..."
3132,3,"Autocatalytic sets are often considered a necessary (but not sufficient) condition for the origin and early evolution of life. Although the idea of autocatalytic sets was already conceived of many years ago, o..."
887,1,"We survey the definitions and use of rank-revealing matrix decompositions in single-channel noise reduction algorithms for speech signals. Our algorithms are based on the rank-reduction paradigm and, in partic..."
1711,1,"We consider the problem of route selection and optimization for a mobile sensor network, which involves two nodes transferring information over a large area using a number of intermediate routers in the presen..."
1152,1,"We study the problem of segmenting, reconstructing, and analyzing the structure growth of thrombi (clots) in blood vessels in vivo based on 2-photon microscopic image data. First, we develop an algorithm for segm..."
1748,1,"In this article, we consider the problem of adaptive detection for a multichannel signal in the presence of spatially and temporally colored compound-Gaussian disturbance. By modeling the disturbance as a mult..."
1824,1,This article presents a probabilistic method for vehicle detection and tracking through the analysis of monocular images obtained from a vehicle-mounted camera. The method is designed to address the main short...
643,2,"NCL, the standard declarative language of the Brazilian Terrestrial Digital TV System and ITU-T Recommendation for IPTV Services, provides a high level of reuse in the design of hypermedia applications. In thi..."
2841,1,Power spectrum optimization is a well-known difficult nonconvex optimization problem for which only local optimality can typically be assured. This paper unifies several classes of local optimization methods a...
142,2,The next generation Graphics Processing Units (GPUs) are being considered for non-graphics applications. Millimeter wave (60 Ghz) wireless networks that are capable of multi-gigabit per second (Gbps) transfer ...
921,1,"We provide a new solution to the problem of feature variations caused by the overlapping of sounds in instrument identification in polyphonic music. When multiple instruments simultaneously play, partials (har..."
1731,1,"This paper proposes a scalable speech coding scheme using the embedded matrix quantization of the LSFs in the LPC model. For an efficient quantization of the spectral parameters, two types of codebooks of diff..."
701,2,"A new framework for image representation, processing, and analysis is introduced and exposed through practical applications. The proposed approach is called logarithmic adaptive neighborhood image processing (..."
392,1,The emerging trend to provide users with ubiquitous seamless wireless access leads to the development of multi-mode terminals able to smartly switch between heterogeneous wireless networks. This switching proc...
3015,2,"As the technology of the Internet of Things (IoT) and mobile edge computing (MEC) develops, more and more tasks are offloaded to the edge servers to be computed. The offloading strategy performs an essential r..."
3020,3,"Almost all existing approaches towards video coding exploit the temporal redundancy by block-matching-based motion estimation and compensation. Regardless of its popularity, block matching still reflects an ad..."
360,2,Particle filtering is a statistical signal processing methodology that has recently gained popularity in solving several problems in signal processing and communications. Particle filters (PFs) have been shown...
1044,1,"The classical application of rate and state dependent frictional constitutive laws has involved the instabilities developed between two sliding surfaces. In such a situation, the behaviour and evolution of asp..."
1409,2,The use of Top Coal Caving for exploiting the thick coal seam with shallow buried depth most likely has a strong negative impact on the stability.
1222,1,"The purpose of this paper is to study the impact of development of skilled work force through investment in training, welfare, working conditions, and wages on the logistics performance index. It also discusse..."
2627,1,"Due to the wide spread of 5G networks, network users have higher requirements for communication delays. Software-defined network is a new paradigm of decoupling the control logic from packet forwarding devices..."
2446,2,This paper is basic research focused on the analysis of scientific advances related to Smart Learning Environments (SLE). Our main objective is to single out the common aspects to propose a new definition whic...
1153,1,Preferential attachment (PA) models of network structure are widely used due to their explanatory power and conceptual simplicity. PA models are able to account for the scale-free degree distributions observed...
630,2,"Enterprises are enhancing investments in cloud services setting up data centers to meet growing demand. A typical investment is of the order of millions of dollars, infrastructure and recurring cost included. ..."
1966,1,Researchers in condensed matter physics are currently exploring new materials for specific use in various applications. The peculiar properties of quantum materials (QMs) have garnered significant attention be...
2234,1,"To estimate the phase velocity using the array observations of microtremors, some algorithms for the estimation include constraints on the array shape, such as equilateral triangles or the placement of receive..."
2114,1,Understanding human socioeconomic development has proven to be one of the most difficult and persistent problems in science and policy. Traditional policy has often attempted to promote human development throu...
811,1,"As governmental subsidies to universities are declining in recent years, sustaining excellence in academic performance and more efficient use of resources have become important issues for university stakeholde..."
1460,2,The purpose of this study was to examine whether fear of missing out (FoMO) mediate relations between social self-efficacy and life satisfaction among undergraduates. The participants involved 323 undergraduat...
2600,1,We propose a novel three-layered neural network-based architecture for predicting the Sixteen Personality Factors from facial features analyzed using Facial Action Coding System. The proposed architecture is b...
2401,1,"The design of aircraft hydraulic pipeline system is limited by many factors, such as the integrity of aviation structure or narrow installation space, so the limited clamp support position should be considered..."
1550,2,Develop and evaluate an ensemble clinical machine learningdeep learning (CML-DL) model integrating deep visual features and clinical data to improve the prediction of supraspinatus/infraspinatus tendon comple...
2645,1,"Discard-based searchis a new approach to searching the content of complex, unlabeled, nonindexed data such as digital photographs, medical images, and real-time surveillance data. The essence of this approach is"
2680,2,"The Global Navigation Satellite Systems (GNSS), including the USs GPS, Chinas BDS, the European Unions Galileo, and Russias GLONASS, offer real-time, all-weather, any-time, anywhere and high precision obse..."
2560,1,"Neural field models describe the coarse-grained activity of populations of interacting neurons. Because of the laminar structure of real cortical tissue they are often studied in two spatial dimensions, where ..."
1343,1,"In this article, we gather results from several projects we conducted recently that use some kind of agile method. We analyze both academic and governmental software development projects, some of them using ag..."
2850,1,"In this paper, we study the dynamics of a quadratic integrate-and-fire neuron, spiking in the gamma (30100 Hz) range, coupled to a delta/theta frequency (18 Hz) neural oscillator. Using analytical and semian..."
3013,3,"This study examines the communications networks formed by direct international Internet links, weighted by bandwidth capacity, each year over the 20022011 period. Specifically, we analyze changes in bandwidth..."
625,2,This paper proposes an architecture and a protocol suite for a permissioned blockchain for a local IoT network. The architecture is based on a sealed Sequencer and a Fog Server running (post-quantum) Guy Fawke...
2920,2,"Numerous studies in the literature describe the effectiveness of research-based instructional strategies (RBIS) in the postsecondary STEM (science, technology, engineering, and mathematics) context. Many of th..."
2970,2,"Online hate is a growing concern on many social media platforms, making them unwelcoming and unsafe. To combat this, technology companies are increasingly developing techniques to automatically identify and sa..."
2675,1,This paper presents a new cycle slip detection and repair method using Total Electron Content Rate (TECR) information derived from individual satellite dual-frequency data of a single Global Positioning System...
455,1,"Quantum computing holds the potential to deliver great economic prosperity to the European Union (EU). However, the creation of successful business in the field is challenging owing to the required extensive i..."
469,1,"Prognostics and health management (PHM) has gotten considerable attention in the background of Industry 4.0. Battery PHM contributes to the reliable and safe operation of electric devices. Nevertheless, releva..."
2075,1,"We aimed to develop a standardized method to investigate the relationship between estimated brain age and regional morphometric features, meeting the criteria for simplicity, generalization, and intuitive inte..."
2598,1,"Implicit block approaches are used by a number of numerical analyzers to model mild, medium, and hard differential systems. Their excellent stability characteristics, self-starting nature, quick convergence, a..."
802,1,"In this work, we introduce a new methodology for inferring the interaction structure of discrete valued time series which are Poisson distributed. While most related methods are premised on continuous state st..."
1989,2,"One of the important issues in designing an EEG-based brain-computer interface is an exact delineation of the rhythms, related to the intended or performed action. Traditionally, related bands were found by tr..."
1433,1,The human auditory system employs a number of principles to facilitate the selection of perceptually separated streams from a complex sound mixture. The brain leverages multi-scale redundant representations of...
1428,2,"If music is the language of the universe, musical note onsets may be the syllables for this language. Not only do note onsets define the temporal pattern of a musical piece, but their time-frequency characteri..."
1474,1,This paper deals with the imaging of a moving target using a multifrequency and multistatic radar consisting in one receiver and several narrowband transmitters. Considering two hypotheses about the studied ta...
3191,1,"The task of bandwidth extension addresses the generation of missing high frequencies of audio signals based on knowledge of the low-frequency part of the sound. This task applies to various problems, such as a..."
2654,1,"This paper presents a model-based method for coding the LSF parameters of LPC speech coders on a ""long-term"" basis, that is, beyond the usual 2030 ms frame duration. The objective is to provide efficient LSF ..."
2864,2,Laser-induced thermotherapy (LITT) is a minimally invasive method causing tumor destruction due to heat ablation and coagulative effects. Computer simulations can play an important role to assist physicians wi...
2648,1,"Model-based medical decision support in terms of computer simulations, predictions and optimization gains increasing importance in health care systems worldwide. This work deals with the control of the glucose..."
149,1,We consider the constrained optimization of excitatory synaptic input patterns to maximize spike generation in leaky integrate-and-fire (LIF) and theta model neurons. In the case of discrete input kicks with a...
1180,1,"July 20th, 2022, marks the 200th anniversary of the Father of Genetics, Gregor Mendels birth. His experiments with pea plants established the fundamental principles of genetic inheritance."
2996,2,"Despite the well-documented and numerous recent successes of deep learning, the application of standard deep architectures to many classification problems within empirical software engineering remains problema..."
3187,1,"The availability of large-scale learning data presents unprecedented opportunities for investigating student learning processes. However, it is challenging for instructors to fully make sense of this data and ..."
1939,1,"To enter new markets and remain competitive in the existing markets, companies need to shift their focus from traditional means and ways to some innovative approaches. Though the paper industry in India has im..."
1982,1,"Discovering the node roles in a network helps to solve diverse social problems. Role discovery attempts to predict the node roles from a network structure, and this method has been extensively studied in vario..."
314,1,Flavin monoamine oxidase gene encodes a protein (MAOB) that forms a part of the flavin monoamine oxidase family in the outer membrane of mitochondria. It plays a role in the tissue metabolism of neuroactive an...
1682,1,"When the free energy of similar but distinct molecule-sized objects is plotted against the temperature at which their energy and entropy contributions cancel, a highly significant linear dependence results fro..."
2253,1,"Path homology is a powerful method for attaching algebraic invariants to digraphs. While there have been growing theoretical developments on the algebro-topological framework surrounding path homology, bona fide ..."
3045,3,"Open Information Extraction (Open IE) aims to obtain not predefined, domain-independent relations from text. This article introduces the Open IE research field, thoroughly discussing the main ideas and systems..."
1441,1,The need for graduates who are immediately prepared for employment has been widely advocated over the last decade to narrow the notorious gap between industry and higher education. Current instructional method...
987,1,"Cloud computing is currently one of the major topics in distributed systems, with large numbers of papers being written on the topic, with major players in the industry releasing a range of software platforms ..."
617,1,"In this research, a transition effect detection scheme for identifying possible highlight segments in baseball videos will be presented. The effects that are inserted manually by the broadcasters for signaling..."
2403,1,"The use of deep learning in medical imaging has increased rapidly over the past few years, finding applications throughout the entire radiology pipeline, from improved scanner performance to automatic disease ..."
2395,1,"In this study, tissue pharmacology and molecular docking methods were used to investigate the therapeutic effect of cyclomastopathy on Chinese Thorowax Rootangelica and its mechanism. The active compounds i..."
1875,1,"Sports-related concussions pose a significant public health concern, and preventative measures are needed to help reduce risk in sport. Vision training could be a suitable prevention strategy for sports-relate..."
2735,2,Handheld gamma cameras with coded aperture collimators are under investigation for intraoperative imaging in nuclear medicine. Coded apertures are a promising collimation technique for applications such as lym...
3008,1,"With the development of deep neural network (DNN) techniques, applications of DNNs show state-of-art performance. In the cloud edge collaborative mode, edge devices upload the raw data, such as texts, images, ..."
2021,2,Researchers now have a new avenue to investigate when it comes to miRNA-based therapeutics. miRNAs have the potential to be valuable biomarkers for disease detection. Variations in miRNA levels may be able to ...
2729,1,The issue of antibiotic resistance in pathogenic microbes is a global concern. This study was aimed to explore in silico and in vitro analysis of the antibacterial efficacy of different natural ligands against ba...
3080,1,"Tamara Grummt passed away on January 26, 2020 in Oelsnitz/Vogtland, Germany. Tamara was one of the scientific pioneers in the field of environmental toxicology, namely genotoxicity and hygiene of drinking and ..."
1245,2,"When a visual search target frequently appears in one target-rich region of space, participants learn to search there first, resulting in faster reaction time when the target appears there than when it appears..."
2472,1,"Analysis of user-generated data (for example process data from logfiles, learning analytics, and data mining) in computer-based environments has gained much attention in the last decade and is considered a pro..."
1886,1,"Modern cargo vessel transport constitutes an important part of global economy; hence it is of paramount importance to develop novel, more efficient reliability methods for cargo ships, especially if onboard re..."
3017,1,The growing interest in electric vehicles (EVs) for transportation has led to increased production and government support through legislation since they offer environmental benefits such as reduced air polluti...
2501,1,"In this paper, we study a simple model of a purely excitatory neural network that, by construction, operates at a critical point. This model allows us to consider various markers of criticality and illustrate ..."
1804,1,Substantial research has been conducted focusing on student outcomes in mathematics courses in order to better understand the ways in which these outcomes depend on the underlying instructional methodologies f...
2099,1,"Surgery is characterized by complex tasks performed in stressful environments. To enhance patient safety and reduce errors, surgeons must be trained in environments that mimic the actual clinical setting. Rasm..."
559,2,"Since the financial crisis of 2008, the theory of financial innovation has been a focus at a time of re-evaluation and re-conceptualization. However, little has been done to evaluate the current state of resea..."
599,1,"A new formulation is proposed for multivariate test, consisting of not only a hierarchy of numerous tests organised in a lattice taxonomy of properties that come from different combinations of multi-variates a..."
256,2,"Intrusion detection systems are increasingly using machine learning. While machine learning has shown excellent performance in identifying malicious traffic, it may increase the risk of privacy leakage. This p..."
